{
  "schema_version": "fishy.recipe.v2",
  "title": "Hand-authored test fixture: planted island",
  "interpretation": "Hand-authored test data for validating the Blender recipe pipeline. This is not model output and is not reconstructed from a photograph.",
  "assumptions": [
    "The tank measures 60 by 30 by 36 centimetres, with 3 centimetres of substrate.",
    "Generic procedural assets represent visual masses rather than identified species or purchasable materials."
  ],
  "tank": {
    "width_m": 0.6,
    "depth_m": 0.3,
    "height_m": 0.36,
    "substrate_depth_m": 0.03
  },
  "design": {
    "composition": "convex",
    "focal_object_id": "wood-01",
    "sightline": "Low grass foreground with open sand at both front corners, leading up to the central wood and stone island.",
    "open_foreground_min": 0.4,
    "mood": "lush",
    "maintenance_tier": "medium",
    "story": "A planted island grown around one fallen branch."
  },
  "objects": [
    {
      "id": "rock-01",
      "label": "Main stone",
      "asset": "rock",
      "position_m": [
        0.21,
        0.13,
        0.03
      ],
      "size_m": [
        0.13,
        0.09,
        0.11
      ],
      "yaw_deg": 15,
      "seed": 21
    },
    {
      "id": "rock-02",
      "label": "Companion stone",
      "asset": "rock",
      "position_m": [
        0.4,
        0.12,
        0.03
      ],
      "size_m": [
        0.08,
        0.06,
        0.07
      ],
      "yaw_deg": -20,
      "seed": 22
    },
    {
      "id": "plant-01",
      "label": "Left background bush",
      "asset": "bush",
      "position_m": [
        0.12,
        0.23,
        0.03
      ],
      "size_m": [
        0.12,
        0.09,
        0.19
      ],
      "yaw_deg": 0,
      "seed": 31
    },
    {
      "id": "plant-02",
      "label": "Right background bush",
      "asset": "bush",
      "position_m": [
        0.47,
        0.23,
        0.03
      ],
      "size_m": [
        0.13,
        0.09,
        0.2
      ],
      "yaw_deg": 0,
      "seed": 32
    },
    {
      "id": "plant-03",
      "label": "Foreground grass",
      "asset": "grass",
      "position_m": [
        0.29,
        0.065,
        0.03
      ],
      "size_m": [
        0.17,
        0.065,
        0.035
      ],
      "yaw_deg": 0,
      "seed": 33
    },
    {
      "id": "wood-01",
      "label": "Branchwood centrepiece",
      "asset": "branchwood",
      "position_m": [
        0.32,
        0.17,
        0.03
      ],
      "size_m": [
        0.26,
        0.12,
        0.22
      ],
      "yaw_deg": -12,
      "seed": 14
    }
  ]
}
